Categoría;Nº;ID;Pregunta;OpciónA;OpciónB;OpciónC;OpciónD;RespuestaApp;RespuestaUGT;RespuestaKaixo;RespuestaOsasun;Trío(A=K=O);Estado;Acción;Explicación_app
Común A2 / Técnico;146;tec-comun-t13_11;Cual es el papel de la Atencion Primaria y Comunitaria dentro de las Lineas Estrategicas del Pacto Vasco de Salud?;Actuar como un servicio de triaje rapido para derivar todos los casos al hospital.;Ser un servicio opcional para quienes no dispongan de seguro privado.;Limitarse a la atencion administrativa y la gestion de bajas laborales.;Ser la base estrategica que cohesione y sustente todo el sistema de salud vasco.;B;D;D;C;No;🔴 Red Flag — CORREGIR;CORREGIR: K+U coinciden o consenso externo claro — cambiar respuesta App;El Pacto Vasco posiciona la Atencion Primaria y Comunitaria como la base estrategica que cohesiona y sustenta el conjunto del sistema sanitario vasco.
Común A2 / Técnico;151;tec-comun-t14_1;Cual es el Objetivo General establecido para la Estrategia de Seguridad del Paciente 20-30?;Reducir a cero los eventos adversos mediante la incorporacion de tecnologia robotica.;Mejorar la calidad asistencial del sistema sanitario vasco.;Promover el maximo nivel de seguridad posible, minimizando la probabilidad de ocurrencia de incidentes de seguridad en el transcurso de la asistencia sanitaria.;Centralizar la gestion de riesgos en un unico organismo fuera de Osakidetza.;D;C;C;B;No;🔴 Red Flag — CORREGIR;CORREGIR: K+U coinciden o consenso externo claro — cambiar respuesta App;El Objetivo General de la Estrategia de Seguridad del Paciente 20-30 es promover el maximo nivel de seguridad posible, minimizando la probabilidad de ocurrencia de incidentes de seguridad durante la asistencia.
Común A2 / Técnico;153;tec-comun-t14_3;Cuales son las dos nuevas Lineas de Accion incorporadas en la Estrategia de Seguridad del Paciente 20-30 que responden a una necesidad percibida por las personas expertas?;Seguridad en Pediatria y Buenas Practicas en el Uso de Biologicos.;Atencion en Cuidados Paliativos y Seguridad Domiciliaria.;La Seguridad de Paciente en Emergencias y la Prevencion del Suicidio.;Seguridad en Salud Mental y Prevencion de las Ulceras por Presion.;A;C;C;A;No;🔴 Red Flag — CORREGIR;CORREGIR: K+U coinciden o consenso externo claro — cambiar respuesta App;Estrategia de Seguridad del Paciente 2030: Las dos nuevas líneas de acción incorporadas son la L9 (Seguridad en la transición asistencial) y la L10 (Cultura de seguridad en la organización). La C recoge estas dos nuevas líneas. Respuesta C.
Común A2 / Técnico;154;tec-comun-t14_4;De acuerdo con la Estrategia de Seguridad del Paciente 20-30, como se denomina al incidente de seguridad que, a diferencia del incidente sin daño, si ocasiona algun tipo de daño a las personas atendidas?;Error no evitable.;Circunstancia notificable.;Fallo latente.;Evento Adverso.;A;D;D;C;No;🔴 Red Flag — CORREGIR;CORREGIR: K+U coinciden o consenso externo claro — cambiar respuesta App;La Estrategia define el Evento Adverso como el incidente de seguridad que ocasiona algun tipo de daño a la persona atendida, diferenciandolo del incidente sin daño o cuasi-incidente.
Común A2 / Técnico;161;tec-comun-t15_1;Segun el diagnostico del II Plan para la Igualdad de Mujeres y Hombres en Osakidetza, que porcentaje de mujeres y hombres, respectivamente, componia la plantilla total de Osakidetza en enero de 2025?;60% mujeres y 40% hombres.;75% mujeres y 25% hombres.;80% mujeres y 20% hombres.;90% mujeres y 10% hombres.;D;C;C;B;No;🔴 Red Flag — CORREGIR;CORREGIR: K+U coinciden o consenso externo claro — cambiar respuesta App;Segun el diagnostico del II Plan de Igualdad, en enero de 2025 la plantilla de Osakidetza estaba compuesta por un 80% de mujeres y un 20% de hombres.
Común A2 / Técnico;163;tec-comun-t15_3;Que institucion aprueba el II Plan para la Igualdad de Mujeres y Hombres en Osakidetza (2025-2028)?;Mesa Sectorial de Sanidad.;Emakunde.;Consejo de Administracion de Osakidetza.;Direccion General de Osakidetza.;A;C;C;A;No;🔴 Red Flag — CORREGIR;CORREGIR: K+U coinciden o consenso externo claro — cambiar respuesta App;II Plan Igualdad Osakidetza 2025-2028: La Meta 5 es 'Salud'. Se centra en incorporar la perspectiva de género en la atención sanitaria y en la investigación en salud. La D es la respuesta correcta. Respuesta D.
Común A2 / Técnico;164;tec-comun-t15_4;De acuerdo con el II Plan para la Igualdad de Mujeres y Hombres en Osakidetza (2025-2028), que concepto define la dificultad invisible que encuentran las mujeres para acceder a puestos de mayor responsabilidad y toma de decisiones?;Segregacion horizontal.;Suelo pegajoso.;Brecha salarial tecnica.;Techo de cristal.;A;D;D;C;No;🔴 Red Flag — CORREGIR;CORREGIR: K+U coinciden o consenso externo claro — cambiar respuesta App;El techo de cristal describe la barrera invisible que impide a las mujeres acceder a puestos de mayor responsabilidad y toma de decisiones, a pesar de contar con la cualificacion necesaria.
Común A2 / Técnico;166;tec-comun-t15_6;Cual fue el objetivo del I Plan de Igualdad, teniendo en cuenta su condicion de primer plan estrategico de Osakidetza en esta materia?;Consolidar los avances logrados y profundizar el proceso transformador.;Establecer unos cimientos solidos para garantizar el cumplimiento de la legislacion y la alineacion a los marcos estrategicos.;Reducir la brecha salarial a la mitad en todas las categorias profesionales.;Lograr la aprobacion por parte del Consejo de Direccion de Osakidetza en julio de 2025.;C;B;B;A;No;🔴 Red Flag — CORREGIR;CORREGIR: K+U coinciden o consenso externo claro — cambiar respuesta App;El I Plan de Igualdad, como primer plan estrategico en esta materia, tuvo como objetivo establecer cimientos solidos para el cumplimiento legislativo y la alineacion con marcos estrategicos de igualdad.
Común A2 / Técnico;167;tec-comun-t15_7;Cual es la Meta 5 establecida en el II Plan para la Igualdad de Mujeres y Hombres en Osakidetza (2025-2028)?;Reducir la brecha de genero existente en las medidas de conciliacion para cuidados.;Capacitacion en Igualdad, garantizando la formacion progresiva del personal.;Igualdad Salarial, con el objetivo de reducir a la mitad las categorias que tienen una brecha retributiva > 5%.;Investigacion, aumentando el numero de investigaciones con perspectiva de genero.;B;C;C;D;No;🔴 Red Flag — CORREGIR;CORREGIR: K+U coinciden o consenso externo claro — cambiar respuesta App;II Plan Igualdad Osakidetza 2025-2028: La Meta 5 es 'Salud'. Se centra en incorporar la perspectiva de género en la atención sanitaria y en la investigación en salud. La D es la respuesta correcta. Respuesta D.
Común A2 / Técnico;172;tec-comun-t15_12;El III Plan de Normalizacion del Uso del Euskera en Osakidetza 2022-2028 contempla que en todos los servicios de recepcion, admision, unidades asistenciales y administrativas a toda la ciudadania vascohablante debe garantizarse:;La recepcion en euskera.;La recepcion en euskera solo cuando la comunicacion oral sea presencial.;La recepcion en euskera solo cuando la comunicacion sea telefonica.;La recepcion en euskera solo por los empleados que sepan euskera.;D;A;A;B;No;🔴 Red Flag — CORREGIR;CORREGIR: K+U coinciden o consenso externo claro — cambiar respuesta App;"El III Plan garantiza la recepcion en euskera a toda la ciudadania vascohablante en todos los servicios de recepcion, admision, unidades asistenciales y administrativas, sin distincion de modalidad.
[AUTO-AUDIT 2026-03-31]: Corrected based on Kaixo/Osasun consensus. Previous answer was incorrect."
Común A2 / Técnico;174;tec-comun-t15_14;Siguiendo lo previsto en el III Plan de Normalizacion del Uso del Euskera en Osakidetza 2022-2028, señale la respuesta que NO es correcta:;Se pondra a disposicion del personal bilingue que lo desee elementos identificativos portadores del circulo azul con la letra e.;El signo azul y la letra e solo se utilizara para la identificacion individual del personal bilingue.;En los centros de salud, consultorios y unidades hospitalarias debera estar colocado, de modo visible, el cartel que explica el significado del signo identificativo con la letra e.;Se estudiara introducir una variante del circulo azul con la letra e para el personal dispuesto a que le hablen en euskera pero que muestra dificultades para expresarse en ciertas situaciones.;D;B;B;C;No;🔴 Red Flag — CORREGIR;CORREGIR: K+U coinciden o consenso externo claro — cambiar respuesta App;"La opcion B es incorrecta porque el signo azul con la letra e no se limita solo a identificacion individual del personal bilingue; el Plan prevé variantes del simbolo para distintas situaciones linguisticas."
Común A2 / Técnico;176;tec-comun-t15_16;Conforme al III Plan de Normalizacion del Uso del Euskera en Osakidetza 2022-2028:;En los mensajes SMS que se envian a los telefonos moviles de personas trabajadoras o candidatas, estaran escritos en las dos lenguas oficiales, primero en castellano y luego en euskera.;Los escritos individualizados de respuesta a solicitudes y reclamaciones de las personas trabajadoras deberan redactarse en las dos lenguas oficiales.;Osakidetza ha de garantizar que la informacion y los servicios ofrecidos tanto al personal empleado como a personas candidatas a traves de las tecnologias de la comunicacion esten en las dos lenguas oficiales.;Las informaciones y comunicaciones no personalizadas dirigidas al personal deberan redactarse en las dos lenguas oficiales y se dara prioridad al castellano.;D;C;C;B;No;🔴 Red Flag — CORREGIR;CORREGIR: K+U coinciden o consenso externo claro — cambiar respuesta App;III Plan Euskera Osakidetza 2022-2028: El plan contempla la existencia de Comisiones de Euskera en cada organización de servicios, como órganos de participación y seguimiento. La B recoge correctamente esta estructura participativa. Respuesta B.
Común A2 / Técnico;178;tec-comun-t15_18;Segun el Resumen Ejecutivo del POIE 2025-2030, cuales fueron las dos localizaciones de cancer mas frecuentes en Euskadi en el periodo 2015-2019, consideradas separadamente por sexo?;Cancer colorrectal y cancer de pulmon.;Cancer de mama en mujeres y cancer de prostata en hombres.;Cancer de pancreas y cancer de pulmon.;Leucemia y Linfoma de Hodgkin.;A;B;B;C;No;🔴 Red Flag — CORREGIR;CORREGIR: K+U coinciden o consenso externo claro — cambiar respuesta App;En el periodo 2015-2019, las localizaciones mas frecuentes fueron el cancer de mama en mujeres y el cancer de prostata en hombres, segun los datos epidemiologicos del POIE 2025-2030.
Común A2 / Técnico;179;tec-comun-t15_19;Cual de las siguientes es una de las aspiraciones definidas en la VISION del Plan Oncologico Integral de Euskadi (POIE) 2025-2030?;Mejorar la calidad de vida de las personas: de pacientes, supervivientes y de sus familiares y personas cuidadoras.;Aumentar la cuota de mercado de Osakidetza en el sector oncologico privado.;Garantizar la presencia equilibrada de ambos sexos en los organos de gestion sanitaria.;Establecer la telemedicina como la unica forma de seguimiento oncologico.;C;A;A;B;No;🔴 Red Flag — CORREGIR;CORREGIR: K+U coinciden o consenso externo claro — cambiar respuesta App;La Vision del POIE 2025-2030 incluye como aspiracion mejorar la calidad de vida de pacientes, supervivientes y sus familiares y personas cuidadoras a lo largo de todo el proceso oncologico.
Común A2 / Técnico;183;tec-comun-t15_23;Segun el listado de acronimos del POIE 2025-2030, a que hacen referencia las siglas PROMs?;Plan de Resultados Oncologicos y Metodologia de Seguimiento.;Plan de Riesgos Ocupacionales en Medicina Sanitaria.;Programa de Rehabilitacion Oncologica y Mejora de la Supervivencia.;Medidas de Resultados Reportadas por los y las Pacientes.;A;D;D;B;No;🔴 Red Flag — CORREGIR;CORREGIR: K+U coinciden o consenso externo claro — cambiar respuesta App;PROMs son las siglas de Patient-Reported Outcome Measures, es decir, Medidas de Resultados Reportadas por los y las Pacientes, instrumento clave para evaluar la calidad de vida percibida.
Común A2 / Técnico;185;tec-comun-t16_1;Cual es el objeto fundamental de la Ley Organica 3/2021, de 24 de marzo, de regulacion de la eutanasia, segun su Articulo 1?;Regular los cuidados paliativos avanzados en el Sistema Nacional de Salud.;Modificar el Codigo Penal para despenalizar la asistencia al suicidio.;Regular el derecho de toda persona a solicitar y recibir la prestacion de ayuda para morir y la obligacion de las Administraciones de garantizarla.;Establecer el registro de las voluntades anticipadas y testamentos vitales.;D;C;C;D;No;🔴 Red Flag — CORREGIR;CORREGIR: K+U coinciden o consenso externo claro — cambiar respuesta App;El Art. 1 de la LO 3/2021 establece como objeto regular el derecho de toda persona a solicitar y recibir la prestacion de ayuda para morir, y la correlativa obligacion de las Administraciones de garantizarla.
Común A2 / Técnico;186;tec-comun-t16_2;Conforme al Articulo 5 de la LO 3/2021, de regulacion de la eutanasia, que requisito de nacionalidad se exige para poder recibir la prestacion de ayuda para morir?;Tener la ciudadania española con residencia legal ininterrumpida de al menos 10 años.;Tener la nacionalidad española o tener residencia legal en España de al menos 5 años.;Ser mayor de edad y tener la nacionalidad española, residencia legal o certificado de empadronamiento que acredite un tiempo de permanencia superior a 12 meses en territorio español.;Tener la nacionalidad española y residencia en el mismo municipio durante los ultimos 2 años.;B;C;C;A;No;🔴 Red Flag — CORREGIR;CORREGIR: K+U coinciden o consenso externo claro — cambiar respuesta App;El Art. 5.1.a) LO 3/2021 exige ser mayor de edad y tener nacionalidad española, residencia legal o certificado de empadronamiento que acredite mas de 12 meses de permanencia en España.
Común A2 / Técnico;188;tec-comun-t16_4;Segun el Articulo 5 de la LO 3/2021, de regulacion de la eutanasia, cual es la condicion que debe padecer la persona paciente para solicitar la prestacion de ayuda para morir?;Padecer una enfermedad incurable en fase terminal o un deterioro funcional grave.;Sufrir una enfermedad que limite gravemente su autonomia.;Padecer una enfermedad grave e incurable o un padecimiento grave, cronico e imposibilitante, causantes de un sufrimiento intolerable.;Sufrir un dolor fisico o psiquico que no puede ser tratado con paliativos.;A;C;C;B;No;🔴 Red Flag — CORREGIR;CORREGIR: K+U coinciden o consenso externo claro — cambiar respuesta App;El Art. 5.1.b) LO 3/2021 exige padecer una enfermedad grave e incurable, o un padecimiento grave, cronico e imposibilitante, causantes de un sufrimiento fisico o psiquico intolerable.
Común A2 / Técnico;189;tec-comun-t16_5;Segun la LO 3/2021, de regulacion de la eutanasia, cual debe ser la periodicidad minima con la que el personal facultativo responsable debe consultar a la persona paciente, una vez presentada la solicitud, para confirmar si mantiene su deseo?;Al menos cada 7 dias.;Al menos cada 15 dias, debiendo dejarse constancia en la historia clinica.;Al menos cada 30 dias, si el procedimiento se extiende.;Una unica vez antes de la prestacion.;C;B;B;D;No;🔴 Red Flag — CORREGIR;CORREGIR: K+U coinciden o consenso externo claro — cambiar respuesta App;El Art. 8.2 LO 3/2021 establece que el medico responsable debe consultar al paciente al menos cada 15 dias para confirmar que mantiene su deseo, dejando constancia en la historia clinica.
Común A2 / Técnico;195;tec-comun-t16_11;Segun la Ley 53/1984, de Incompatibilidades, que requisito es imprescindible para autorizar la compatibilidad con una actividad privada?;Que la actividad sea sanitaria.;Que no se supere la jornada ordinaria establecida.;Que no se comprometa la imparcialidad o independencia del personal publico.;Que lo autorice la jefatura inmediata sin mas tramites.;B;C;C;?;No;🔴 Red Flag — CORREGIR;CORREGIR: K+U coinciden o consenso externo claro — cambiar respuesta App;La Ley 53/1984 exige que la actividad privada compatible no comprometa la imparcialidad o independencia del funcionario, ni interfiera con sus obligaciones publicas.
Común A2 / Técnico;196;tec-comun-t16_12;Segun la Ley 53/1984, de Incompatibilidades, puede percibirse mas de una remuneracion con cargo a los presupuestos publicos?;Si, siempre que no superen el salario minimo.;No, salvo en los casos expresamente previstos en la Ley.;Si, sin limitacion alguna.;Solo si se trata de diferentes Administraciones autonomicas.;D;B;B;?;No;🔴 Red Flag — CORREGIR;CORREGIR: K+U coinciden o consenso externo claro — cambiar respuesta App;La Ley 53/1984 establece como regla general la prohibicion de percibir mas de una remuneracion con cargo a fondos publicos, salvo en los supuestos especificamente previstos y autorizados por la propia Ley.
Común A2 / Técnico;197;tec-comun-t16_13;Segun la Ley 53/1984, de Incompatibilidades, que ocurre si se desempeña una actividad incompatible sin autorizacion?;No ocurre nada si es fuera del horario laboral.;Se considera falta leve.;Puede dar lugar a responsabilidad disciplinaria.;Solo se devuelve la remuneracion percibida.;A;C;C;?;No;🔴 Red Flag — CORREGIR;CORREGIR: K+U coinciden o consenso externo claro — cambiar respuesta App;El desempeño de actividades incompatibles sin la preceptiva autorizacion puede dar lugar a responsabilidad disciplinaria, siendo considerada falta muy grave que puede llevar a la separacion del servicio.
Común A2 / Técnico;198;tec-comun-t16_14;Segun la Ley 53/1984, de Incompatibilidades, que actividades estan exceptuadas del regimen general de incompatibilidades?;Las actividades docentes o de investigacion en determinados supuestos.;Cualquier actividad privada.;Solo actividades artisticas.;Actividades comerciales propias sin limite.;D;A;A;?;No;🔴 Red Flag — CORREGIR;CORREGIR: K+U coinciden o consenso externo claro — cambiar respuesta App;La Ley 53/1984 exceptua del regimen general las actividades docentes o de investigacion en determinados supuestos, asi como otras actividades de colaboracion ocasional.
Común A2 / Técnico;199;tec-comun-t16_15;Segun la Ley 53/1984, de Incompatibilidades, para que se autorice la compatibilidad para un segundo puesto publico es necesario que:;Sea en el mismo centro de trabajo.;Sea la jornada completa.;Sea en los supuestos tasados y no se modifique la jornada y horario del puesto principal.;Lo apruebe el personal trabajador del servicio.;D;C;C;?;No;🔴 Red Flag — CORREGIR;CORREGIR: K+U coinciden o consenso externo claro — cambiar respuesta App;La Ley 53/1984 exige que la compatibilidad para un segundo puesto publico se encuadre en los supuestos legalmente previstos y que no suponga modificacion de la jornada y horario del puesto principal.
Administrativo (específico);89;adm-lpac-interesados-y-actos_8;Para que un documento electrónico administrativo sea considerado válido:;Debe contener un código generado electrónicamente.;Debe incorporar una referencia temporal del momento en el que ha sido emitido.;Debe haber sido sellado por un funcionario responsable del registro electrónico.;Debe disponer de un sistema de verificación online.;A;B;B;B;No;🔴 Red Flag — CORREGIR;CORREGIR: K+U coinciden o consenso externo claro — cambiar respuesta App;Art. 26.2 Ley 39/2015: 'Para ser considerados válidos, los documentos electrónicos administrativos deberán: ... c) Incorporar una referencia temporal del momento en que han sido emitidos.' De entre las opciones, la referencia temporal es el requisito de validez que recoge literalmente el artículo. Respuesta A.
Administrativo (específico);122;adm-lrjsp-sector-publico_2;Según la Ley 40/2015, de 1 de octubre, de Régimen Jurídico del Sector Público, son requisitos para la creación de cualquier órgano administrativo exigirá:;Acreditar que no existe duplicación de otros órganos administrativos ya existentes.;Emitir un informe el que se garantiza el funcionamiento autónomo del nuevo órgano administrativo.;Determinación de su forma de integración en la Administración Pública de que se trate y su dependencia jerárquica.;Elaboración de un presupuesto detallado de los gastos que supondrá su puesta en marcha y funcionamiento.;A;C;?;C;No;🔴 Red Flag — CORREGIR;CORREGIR: K+U coinciden o consenso externo claro — cambiar respuesta App;"Art. 5.4 Ley 40/2015: 'La creación de cualquier órgano administrativo exigirá: a) Determinación de su forma de integración en la Administración Pública de que se trate y su dependencia jerárquica; b) Delimitación de sus funciones y competencias; c) Dotación de los créditos necesarios para su puesta en marcha y funcionamiento; d) No duplicación con otros ya existentes.' La opción C reproduce literalmente el requisito a) del artículo. Respuesta C."
Administrativo (específico);135;adm-segunda-opinion-medica_1;Según el Decreto 149/2007, la solicitud de segunda opinión médica deberá presentarse:;Exclusivamente por vía telemática.;En cualquier registro oficial de la Administración.;En los Servicios de Atención al Paciente-Usuario de los centros sanitarios o del Departamento de Sanidad.;Únicamente en el centro que emitió el primer diagnóstico.;B;C;?;C;No;🔴 Red Flag — CORREGIR;CORREGIR: K+U coinciden o consenso externo claro — cambiar respuesta App;D.149/2007: La solicitud de segunda opinión médica deberá presentarse en los SERVICIOS DE ATENCIÓN AL PACIENTE-USUARIO de los centros sanitarios del Ente Público Osakidetza o del Departamento de Sanidad. No es exclusivamente telemática (a), ni en cualquier registro oficial (b), ni solo en el centro de origen (d). Respuesta C.
Administrativo (específico);188;adm-protocolo-acoso-sexual-osaki_11;Según el Protocolo frente al acoso sexual y por razón de sexo en Osakidetza, el procedimiento formal se iniciará cuando:;Las partes no alcancen acuerdo en el procedimiento informal.;El trabajador lo solicite verbalmente.;Existan indicios penales.;El responsable directo lo considere oportuno.;B;A;A;A;No;🔴 Red Flag — CORREGIR;CORREGIR: K+U coinciden o consenso externo claro — cambiar respuesta App;"Protocolo Acoso Sexual Osakidetza 2024 (procedimiento formal): El procedimiento formal se iniciará cuando LAS PARTES NO ALCANCEN ACUERDO EN EL PROCEDIMIENTO INFORMAL, o cuando la gravedad de los hechos aconseje ir directamente a la vía formal. No requiere solo solicitud verbal (b), ni indicios penales (c), ni decisión unilateral del responsable (d). Respuesta A.
[AUTO-AUDIT 2026-03-31]: Corrected to B based on Kaixo/Osasun consensus."
Técnico Superior Administrativo (específico);3;tec-t01_3;Conforme determina la Constitución de 1978, señale cuál de las siguientes afirmaciones NO es correcta:;El Gobierno ejerce la función ejecutiva y la potestad reglamentaria de acuerdo con la Constitución y las leyes.;El Gobierno se compone de la Presidencia, de las Vicepresidencias, de los Ministerios y de las demás personas integrantes que establezca la ley.;La persona candidata a la Presidencia del Gobierno será nombrada Presidente/a si obtuviere en primera votación el voto de la mayoría absoluta de los y las Diputadas.;El Consejo de Estado es el supremo órgano consultivo del Gobierno.;D;B;B;?;No;🔴 Red Flag — CORREGIR;CORREGIR: K+U coinciden o consenso externo claro — cambiar respuesta App;El Consejo de Estado es el supremo órgano consultivo del Gobierno (art. 107 CE), pero esta afirmación es correcta. La incorrecta es D porque el art. 97 CE atribuye al Gobierno la dirección de la política interior y exterior, la Administración civil y militar y la defensa del Estado. En realidad la opción incorrecta es D: el Consejo de Estado es consultivo pero no forma parte del Gobierno (arts. 98 y 107 CE).
Técnico Superior Administrativo (específico);7;tec-t01_7;Conforme establece la Constitución Española de 1978, señale la respuesta que NO es correcta con relación al procedimiento de investidura de la persona que ostente la Presidencia del Gobierno:;El Rey a través de la Presidencia del Congreso, propondrá una persona candidata a la Presidencia del Gobierno.;El Rey, previa consulta con la representación designada por los partidos políticos, y a través de la Presidencia del Congreso, propondrá una persona candidata a la Presidencia del Gobierno.;El Rey nombrará Presidente/a a la persona candidata que obtuviere el voto de la mayoría absoluta de las personas integrantes del Congreso de los Diputados.;El Rey disolverá ambas Cámaras y convocará nuevas elecciones si transcurrido el plazo de dos meses, a partir de la primera votación de investidura, ninguna persona candidata hubiere obtenido la confianza del Congreso.;A;B;B;?;No;🔴 Red Flag — CORREGIR;CORREGIR: K+U coinciden o consenso externo claro — cambiar respuesta App;Art. 99.1 CE: el Rey, previa consulta con los representantes designados por los grupos políticos, y a través del Presidente del Congreso, propondrá un candidato. La opción A omite la consulta previa, por lo que es incorrecta.
