Categoría;Nº;ID;Pregunta;OpciónA;OpciónB;OpciónC;OpciónD;RespuestaApp;RespuestaKaixo;RespuestaOsasun;Trío(A=K=O);Estado;Acción;Explicación_app
Común A2 / Técnico;176;tec-comun-t15_16;Conforme al III Plan de Normalizacion del Uso del Euskera en Osakidetza 2022-2028:;En los mensajes SMS que se envian a los telefonos moviles de personas trabajadoras o candidatas, estaran escritos en las dos lenguas oficiales, primero en castellano y luego en euskera.;Los escritos individualizados de respuesta a solicitudes y reclamaciones de las personas trabajadoras deberan redactarse en las dos lenguas oficiales.;Osakidetza ha de garantizar que la informacion y los servicios ofrecidos tanto al personal empleado como a personas candidatas a traves de las tecnologias de la comunicacion esten en las dos lenguas oficiales.;Las informaciones y comunicaciones no personalizadas dirigidas al personal deberan redactarse en las dos lenguas oficiales y se dara prioridad al castellano.;D;C;B;No;Disputa triple;REVISAR MANUALMENTE: consultar texto legal;III Plan Euskera Osakidetza 2022-2028: El plan contempla la existencia de Comisiones de Euskera en cada organización de servicios, como órganos de participación y seguimiento. La B recoge correctamente esta estructura participativa. Respuesta B.
Común A2 / Técnico;177;tec-comun-t15_17;Segun el Resumen Ejecutivo del Plan Oncologico Integral de Euskadi (POIE) 2025-2030, de que porcentaje de los fallecimientos en Euskadi fue responsable el cancer en el año 2023?;22,3%.;Menos del 15%.;33,8%.;28%.;B;C;A;No;Disputa triple;REVISAR MANUALMENTE: consultar texto legal;POIE 2025-2030 (Resumen Ejecutivo): El cáncer es responsable del 28% de las muertes en Euskadi, siendo la segunda causa de mortalidad. La C recoge correctamente este porcentaje. Respuesta C.
Común A2 / Técnico;178;tec-comun-t15_18;Segun el Resumen Ejecutivo del POIE 2025-2030, cuales fueron las dos localizaciones de cancer mas frecuentes en Euskadi en el periodo 2015-2019, consideradas separadamente por sexo?;Cancer colorrectal y cancer de pulmon.;Cancer de mama en mujeres y cancer de prostata en hombres.;Cancer de pancreas y cancer de pulmon.;Leucemia y Linfoma de Hodgkin.;A;B;C;No;Disputa triple;REVISAR MANUALMENTE: consultar texto legal;En el periodo 2015-2019, las localizaciones mas frecuentes fueron el cancer de mama en mujeres y el cancer de prostata en hombres, segun los datos epidemiologicos del POIE 2025-2030.
Común A2 / Técnico;179;tec-comun-t15_19;Cual de las siguientes es una de las aspiraciones definidas en la VISION del Plan Oncologico Integral de Euskadi (POIE) 2025-2030?;Mejorar la calidad de vida de las personas: de pacientes, supervivientes y de sus familiares y personas cuidadoras.;Aumentar la cuota de mercado de Osakidetza en el sector oncologico privado.;Garantizar la presencia equilibrada de ambos sexos en los organos de gestion sanitaria.;Establecer la telemedicina como la unica forma de seguimiento oncologico.;C;A;B;No;Disputa triple;REVISAR MANUALMENTE: consultar texto legal;La Vision del POIE 2025-2030 incluye como aspiracion mejorar la calidad de vida de pacientes, supervivientes y sus familiares y personas cuidadoras a lo largo de todo el proceso oncologico.
Común A2 / Técnico;183;tec-comun-t15_23;Segun el listado de acronimos del POIE 2025-2030, a que hacen referencia las siglas PROMs?;Plan de Resultados Oncologicos y Metodologia de Seguimiento.;Plan de Riesgos Ocupacionales en Medicina Sanitaria.;Programa de Rehabilitacion Oncologica y Mejora de la Supervivencia.;Medidas de Resultados Reportadas por los y las Pacientes.;A;D;B;No;Disputa triple;REVISAR MANUALMENTE: consultar texto legal;PROMs son las siglas de Patient-Reported Outcome Measures, es decir, Medidas de Resultados Reportadas por los y las Pacientes, instrumento clave para evaluar la calidad de vida percibida.
Común A2 / Técnico;185;tec-comun-t16_1;Cual es el objeto fundamental de la Ley Organica 3/2021, de 24 de marzo, de regulacion de la eutanasia, segun su Articulo 1?;Regular los cuidados paliativos avanzados en el Sistema Nacional de Salud.;Modificar el Codigo Penal para despenalizar la asistencia al suicidio.;Regular el derecho de toda persona a solicitar y recibir la prestacion de ayuda para morir y la obligacion de las Administraciones de garantizarla.;Establecer el registro de las voluntades anticipadas y testamentos vitales.;D;C;D;No;Disputa triple;REVISAR MANUALMENTE: consultar texto legal;El Art. 1 de la LO 3/2021 establece como objeto regular el derecho de toda persona a solicitar y recibir la prestacion de ayuda para morir, y la correlativa obligacion de las Administraciones de garantizarla.
Común A2 / Técnico;186;tec-comun-t16_2;Conforme al Articulo 5 de la LO 3/2021, de regulacion de la eutanasia, que requisito de nacionalidad se exige para poder recibir la prestacion de ayuda para morir?;Tener la ciudadania española con residencia legal ininterrumpida de al menos 10 años.;Tener la nacionalidad española o tener residencia legal en España de al menos 5 años.;Ser mayor de edad y tener la nacionalidad española, residencia legal o certificado de empadronamiento que acredite un tiempo de permanencia superior a 12 meses en territorio español.;Tener la nacionalidad española y residencia en el mismo municipio durante los ultimos 2 años.;B;C;A;No;Disputa triple;REVISAR MANUALMENTE: consultar texto legal;El Art. 5.1.a) LO 3/2021 exige ser mayor de edad y tener nacionalidad española, residencia legal o certificado de empadronamiento que acredite mas de 12 meses de permanencia en España.
Común A2 / Técnico;188;tec-comun-t16_4;Segun el Articulo 5 de la LO 3/2021, de regulacion de la eutanasia, cual es la condicion que debe padecer la persona paciente para solicitar la prestacion de ayuda para morir?;Padecer una enfermedad incurable en fase terminal o un deterioro funcional grave.;Sufrir una enfermedad que limite gravemente su autonomia.;Padecer una enfermedad grave e incurable o un padecimiento grave, cronico e imposibilitante, causantes de un sufrimiento intolerable.;Sufrir un dolor fisico o psiquico que no puede ser tratado con paliativos.;A;C;B;No;Disputa triple;REVISAR MANUALMENTE: consultar texto legal;El Art. 5.1.b) LO 3/2021 exige padecer una enfermedad grave e incurable, o un padecimiento grave, cronico e imposibilitante, causantes de un sufrimiento fisico o psiquico intolerable.
Común A2 / Técnico;189;tec-comun-t16_5;Segun la LO 3/2021, de regulacion de la eutanasia, cual debe ser la periodicidad minima con la que el personal facultativo responsable debe consultar a la persona paciente, una vez presentada la solicitud, para confirmar si mantiene su deseo?;Al menos cada 7 dias.;Al menos cada 15 dias, debiendo dejarse constancia en la historia clinica.;Al menos cada 30 dias, si el procedimiento se extiende.;Una unica vez antes de la prestacion.;C;B;D;No;Disputa triple;REVISAR MANUALMENTE: consultar texto legal;El Art. 8.2 LO 3/2021 establece que el medico responsable debe consultar al paciente al menos cada 15 dias para confirmar que mantiene su deseo, dejando constancia en la historia clinica.
