Categoría;Nº;ID;Pregunta;OpciónA;OpciónB;OpciónC;OpciónD;RespuestaIA;RespuestaApp;RespuestaUGT;RespuestaKaixo;RespuestaOsasun;Trío(A=K=O);Confianza;Estado;Acción;Explicación_app
Común C2 (AUX + ADM);23;comun-t02_3;Según dispone la Ley 16/2003, de 28 de mayo, de cohesión y calidad del Sistema Nacional de Salud, la ciudadanía tendrá los siguientes derechos en el conjunto del Sistema Nacional de Salud:;A recibir asistencia sanitaria en su comunidad autónoma de residencia.;A recibir el reembolso de los gastos derivados de la asistencia en la sanidad privada cuando se trate de servicios recogidos en el catálogo de prestaciones del Sistema Nacional de Salud.;A recibir el reembolso de los gastos derivados de la asistencia sanitaria del catálogo de prestaciones del Sistema Nacional de Salud que pudiera requerir del servicio de salud de la comunidad autónoma en la que se encuentre desplazado/a.;Ninguna de las respuestas anteriores es correcta.;C;A;D;A;C;No;13.1%;Disputa / Duda;REVISAR MANUALMENTE: consulta texto legal;Art. 7 Ley 16/2003: La cartera de servicios comunes del SNS se establece mediante Real Decreto del Consejo de Ministros, a propuesta del Ministro de Sanidad, previo acuerdo del Consejo Interterritorial. Se actualiza periódicamente. La C recoge correctamente el procedimiento de aprobación y actualización. Respuesta C.
Común C2 (AUX + ADM);58;comun-t03_17;La Ley 55/2003, de 16 de diciembre, del Estatuto Marco del personal estatutario de los servicios de salud regula el descanso semanal. Señale la respuesta que no es correcta:;El personal tendrá derecho a un período mínimo que siempre será fijo de descanso ininterrumpido con una duración media de 24 horas semanales.;El período de referencia para el cálculo del período de descanso semanal será de tres meses.;En el caso de que no se hubiera disfrutado del tiempo mínimo de descanso semanal en el período de tres meses se producirá una compensación a través del régimen de descansos alternativos.;El período de referencia para el cálculo del período de descanso semanal será de dos meses.;C;D;B;D;A;No;15.3%;Disputa / Duda;REVISAR MANUALMENTE: consulta texto legal;Art. 38 Ley 55/2003: La promoción interna temporal consiste en la ocupación transitoria de plazas de categoría superior, manteniéndose la relación estatutaria de origen. Tiene carácter excepcional y requiere cumplir los requisitos exigidos para el ingreso en la categoría superior. Respuesta C.
Común C2 (AUX + ADM);81;comun-t04_20;El ente público Osakidetza-Servicio Vasco de Salud es:;El Ente Institucional de la Comunidad Autónoma, de naturaleza pública y bajo la calificación de ente público de derecho privado o público.;El Ente Institucional de la Comunidad Autónoma, de naturaleza pública y bajo la calificación de ente público de derecho público;El Ente Institucional de la Comunidad Autónoma, de naturaleza pública y bajo la calificación de ente público de derecho privado;Las tres anteriores son erróneas;A;D;C;D;A;No;13.1%;Disputa / Duda;REVISAR MANUALMENTE: consulta texto legal;Art. 31 Ley 8/1997 y Decreto 255/1997: Osakidetza es un ente público de derecho privado, con personalidad jurídica propia y plena capacidad para el cumplimiento de sus fines, sometido al derecho privado en sus relaciones externas excepto en el ejercicio de potestades públicas. No es organismo autónomo ni agencia, sino ente público. Respuesta A.
Común C2 (AUX + ADM);100;comun-t04_31;En el ámbito de una organización de servicios sanitarios del ente público Osakidetza-Servicio Vasco de Salud, presidir los Consejos Técnicos de participación profesional y promover su eficaz funcionamiento es una tarea que corresponde a:;La Dirección General del Ente.;Quien ostente la titularidad de la Dirección-Gerencia del Ente.;La Dirección Médica del Ente.;Ninguna de las anteriores.;B;D;C;D;B;No;13.1%;Disputa / Duda;REVISAR MANUALMENTE: consulta texto legal;Decreto 255/1997: La presidencia de los Consejos Técnicos de participación profesional y promover su eficaz funcionamiento corresponde a 'quien ostente la titularidad de la DIRECCIÓN-GERENCIA del Ente.' Respuesta B.
Común C2 (AUX + ADM);107;comun-t04_38;Según el Decreto 100/2018 de las organizaciones sanitarias integradas del ente público Osakidetza-Servicio Vasco de Salud, para que una OSI sea clasificada como de Tipo III debe integrar, junto con servicios de atención primaria, un hospital de carácter general y tener una base poblacional atendida inferior a:;500.000 habitantes.;200.000 habitantes.;300.000 habitantes.;100.000 habitantes.;B;D;C;D;B;No;13.1%;Disputa / Duda;REVISAR MANUALMENTE: consulta texto legal;Art. 4 Decreto 100/2018: Las OSI de Tipo III integran atención primaria con hospital general y tienen una base poblacional atendida inferior a 200.000 habitantes. Respuesta B.
Común C2 (AUX + ADM);124;comun-t04_55;El Decreto 147/2015, de 21 de julio, por el que se aprueba la Declaración sobre Derechos y Deberes de las personas en el sistema sanitario de Euskadi, distingue bloques de derechos relacionados con los siguientes ámbitos:;"Relaciones asistenciales; participación responsable en la gestión de la propia salud; organización y gestión del sistema sanitario de Euskadi; políticas sanitarias específicas; asistencia sanitaria específica vinculada a la infancia y adolescencia; asistencia sanitaria específica referida a la salud sexual y reproductiva; asistencia sanitaria específica referida a las personas mayores; asistencia sanitaria específica referida al final de la vida; participación en la investigación biomédica; obtención de la Tarjeta Individual Sanitaria.";"Relaciones asistenciales; participación responsable en la gestión de la propia salud; organización y gestión del sistema sanitario de Euskadi; políticas sanitarias específicas; asistencia sanitaria específica vinculada a la infancia y adolescencia; asistencia sanitaria específica referida a la salud sexual y reproductiva; asistencia sanitaria específica referida a las personas mayores; asistencia sanitaria específica referida al final de la vida; derechos en relación con la docencia del personal sanitario, obtención de la Tarjeta Individual Sanitaria.";"Relaciones asistenciales; participación responsable en la gestión de la propia salud; organización y gestión del sistema sanitario de Euskadi; políticas sanitarias específicas; asistencia sanitaria específica vinculada a la infancia y adolescencia; asistencia sanitaria específica referida a la salud sexual y reproductiva; asistencia sanitaria específica referida a las personas mayores; asistencia sanitaria específica referida al final de la vida; medidas de salud pública; obtención de la Tarjeta Individual Sanitaria.";"Relaciones asistenciales; participación responsable en la gestión de la propia salud; organización y gestión del sistema sanitario de Euskadi; políticas sanitarias específicas; asistencia sanitaria específica vinculada a la infancia y adolescencia; asistencia sanitaria específica referida a la salud sexual y reproductiva; asistencia sanitaria específica referida a las personas mayores; asistencia sanitaria específica referida al final de la vida; obtención de la Tarjeta Individual Sanitaria.";B;C;D;C;A;No;15.3%;Disputa / Duda;REVISAR MANUALMENTE: consulta texto legal;Ámbitos D.147/2015 incluyen investigación biomédica.
Común C2 (AUX + ADM);290;comun-t18_10;Según la Ley Orgánica 3/2021, de 24 de marzo, de regulación de la eutanasia, ¿cuál es el plazo que tiene la persona facultativa responsable para comunicar la resolución favorable a la Comisión de Garantía y Evaluación para su posterior verificación?;Dentro de las 24 horas siguientes a la resolución.;Dentro del día siguiente natural a la resolución.;7 días desde la resolución favorable.;No existe un plazo establecido para esta comunicación.;B;D;A;D;B;No;13.1%;Disputa / Duda;REVISAR MANUALMENTE: consulta texto legal;Art. 3 LO 3/2021: La ley distingue entre 'eutanasia' (médico administra directamente la sustancia) y 'suicidio médicamente asistido' (médico prescribe o suministra la sustancia pero la administra la propia persona). Respuesta B.
Común A2 / Técnico;1;tec-comun-t01_1;De acuerdo con las normas generales de ordenación de las profesiones sanitarias, para poder ejercer una profesión sanitaria será requisito imprescindible:;La colegiación, cuando una ley estatal establezca esta obligación para el ejercicio de una profesión titulada o algunas actividades propias de ésta.;"La inexistencia de inhabilitación o suspensión para el ejercicio profesional por sentencia judicial, aunque no sea firme, durante el periodo de tiempo que fije ésta; por resolución sancionadora impuesta por un colegio profesional sanitario, cuando una ley estatal establezca para este ejercicio la obligación de pertenecer al colegio profesional respectivo durante el periodo de tiempo que fije ésta; o por resolución administrativa sancionadora firme, durante el periodo de tiempo que fije ésta, cuando se ejerza la profesión en el ámbito de la asistencia sanitaria pública.";Tener suscrito y vigente un seguro de responsabilidad, un aval u otra garantía financiera, ya sean de protección personal o colectiva, que cubra las indemnizaciones que se puedan derivar de la responsabilidad profesional por un eventual daño a las personas, causado con ocasión de la prestación de tal asistencia o servicios, cuando se ejerza la profesión en el ámbito de la asistencia sanitaria pública.;Todo lo anterior.;C;D;A;D;D;No;14.0%;Disputa / Duda;REVISAR MANUALMENTE: consulta texto legal;Art. 2 Ley 44/2003: Para ejercer una profesión sanitaria son requisitos: la colegiación (cuando ley estatal la exija), la inexistencia de inhabilitación o suspensión, Y tener suscrito seguro de responsabilidad cuando se ejerza en asistencia sanitaria pública. Al tratarse de requisitos acumulativos, 'todo lo anterior' es la respuesta correcta. Respuesta D.
Común A2 / Técnico;48;tec-comun-t04_13;Según establece la Ley 8/1997, de 26 de junio, de Ordenación Sanitaria de Euskadi, en materia de sanciones señale la respuesta correcta:;Las infracciones serán sancionadas exclusivamente con sanción pecuniaria o económica.;En los casos de infracciones muy graves, el Gobierno Vasco podrá acordar el cierre temporal del establecimiento por un plazo máximo de cinco años.;Sin perjuicio de la multa que proceda imponer, en ciertos casos, la sanción económica que se imponga podrá ser incrementada hasta el triple de la cuantía del beneficio ilícito obtenido.;En los casos de infracciones muy graves, el Gobierno Vasco podrá acordar el cierre temporal del establecimiento por un plazo máximo de tres años.;C;A;B;C;A;No;25.8%;Disputa / Duda;REVISAR MANUALMENTE: consulta texto legal;Art. 49 Ley 8/1997: en determinados casos, la sanción económica puede incrementarse hasta el triple del beneficio ilícito obtenido. El cierre temporal máximo es 5 años (no 3), y las sanciones no son solo pecuniarias.
Común A2 / Técnico;80;tec-comun-t05_15;Según el Artículo 19.1 del Decreto 100/2018 de las OSI de Osakidetza, ¿quién ejerce la presidencia del Consejo Clínico Asistencial?;La persona titular de la Dirección Gerencia.;La persona titular de la Dirección Médica.;La persona titular de la Dirección de Enfermería.;La persona de mayor antigüedad en la vocalía de Atención Primaria.;A;D;B;A;?;No;36.3%;Disputa / Duda;REVISAR MANUALMENTE: consulta texto legal;Art. 19.1 Decreto 100/2018: la presidencia del Consejo Clínico Asistencial corresponde a la persona titular de la Dirección Gerencia de la OSI.
Común A2 / Técnico;82;tec-comun-t06_2;Según el Decreto 147/2015, de 21 de julio, todos los derechos y obligaciones establecidos son exigibles:;En relación a todas las acciones de carácter sanitario, incluyendo docencia, en centros de titularidad pública o privada o concertados de Euskadi. Las acciones relativas a la investigación biomédica quedan fuera de esta Declaración.;En relación a todas las acciones de carácter sanitario, incluyendo docencia, en centros de titularidad pública o concertados del sistema sanitario de Euskadi. Las acciones relativas a la investigación biomédica quedan fuera de esta Declaración.;En relación a todas las acciones de carácter sanitario, incluyendo investigación y docencia, en centros de titularidad pública o privada o concertados de Euskadi.;En relación a todas las acciones de carácter sanitario, incluyendo investigación y docencia, en centros de titularidad pública o concertados del sistema sanitario de Euskadi.;A;B;C;A;?;No;36.3%;Disputa / Duda;REVISAR MANUALMENTE: consulta texto legal;Art. 3 Decreto 147/2015: los derechos son exigibles en centros de titularidad pública, privada o concertados de Euskadi, incluyendo docencia. La investigación biomédica se rige por su normativa específica.
Común A2 / Técnico;83;tec-comun-t06_3;Según el Decreto 147/2015, de 21 de julio, los principios que informan e inspiran el conjunto de acciones de carácter sanitario del sistema sanitario de Euskadi son:;El respeto a la libertad de la persona, a su dignidad y a la autonomía en las decisiones que afecten a su salud.;El respeto a todo el personal profesional que integra el sistema sanitario de Euskadi.;La promoción de la investigación científica en el marco del sistema sanitario de Euskadi.;Todas las respuestas anteriores son correctas.;D;A;A;D;?;No;36.3%;Disputa / Duda;REVISAR MANUALMENTE: consulta texto legal;Art. 4 Decreto 147/2015: el principio fundamental es el respeto a la libertad, dignidad y autonomía de la persona en las decisiones sobre su salud. Las opciones b y c no son principios informadores de la Declaración.
Común A2 / Técnico;103;tec-comun-t09_7;Según dispone la Ley 7/2002, de 12 de diciembre, de las voluntades anticipadas, la voluntad de la persona prevalece sobre las instrucciones contenidas en el documento de voluntades anticipadas ante cualquier intervención clínica siempre que:;La persona otorgante conserve su capacidad y su libertad de actuación.;La persona otorgante conserve su capacidad, su libertad de actuación y la posibilidad de expresarse.;La persona otorgante conserve su capacidad, su libertad de actuación y la posibilidad de expresarse de manera inequívoca.;La persona otorgante conserve su capacidad, su libertad de actuación y la posibilidad de expresarse de manera inequívoca o a través de la persona interlocutora designada al efecto.;C;B;B;C;D;No;25.8%;Disputa / Duda;REVISAR MANUALMENTE: consulta texto legal;Art. 5 Ley 7/2002: la voluntad actual del paciente prevalece sobre el documento cuando conserva su capacidad, libertad de actuación y puede expresarse de manera inequívoca.
Común A2 / Técnico;112;tec-comun-t10_8;Respecto a los sistemas de información de denuncias internas que contempla la Ley Orgánica 3/2018, de 5 de diciembre, de Protección de Datos Personales, es correcta la siguiente afirmación:;En todo caso, transcurridos tres meses desde la introducción de los datos, deberá procederse a su supresión del sistema de denuncias, salvo que la finalidad de la conservación sea dejar evidencia del funcionamiento del modelo de prevención de la comisión de delitos.;En todo caso, transcurridos seis meses desde la introducción de los datos, deberá procederse a su supresión del sistema de denuncias, salvo que la finalidad de la conservación sea dejar evidencia del funcionamiento del modelo de prevención de la comisión de delitos.;En todo caso, y sin excepción, transcurridos seis meses desde la introducción de los datos, deberá procederse a su supresión del sistema de denuncias.;La Ley no prevé plazo temporal alguno para la supresión de los datos del sistema de denuncias.;B;A;D;A;C;No;15.3%;Disputa / Duda;REVISAR MANUALMENTE: consulta texto legal;Art. 24 LO 3/2018: Los sistemas de denuncias internas deben garantizar la confidencialidad del denunciante. Los datos conservados sólo podrán ser accedidos por quienes sean indispensables para resolver la denuncia. La B recoge correctamente los requisitos de confidencialidad. Respuesta B.
Común A2 / Técnico;156;tec-comun-t14_6;Cual de los siguientes es el Objetivo Especifico numero 1 de la Estrategia de Seguridad del Paciente 20-30, enfocado en el cambio interno?;Garantizar la continuidad de las lineas de accion y proyectos previamente implantados.;Impulsar la cultura de seguridad de paciente en las organizaciones de servicios de Osakidetza, promoviendo la formacion y sensibilizacion como aspectos clave.;Optimizar la prescripcion de pruebas diagnosticas que utilizan radiacion ionizante.;Implantar un sistema de identificacion inequivoca de pacientes en todas las fases del proceso asistencial.;B;C;A;B;D;No;25.8%;Disputa / Duda;REVISAR MANUALMENTE: consulta texto legal;El Objetivo Especifico 1 es impulsar la cultura de seguridad del paciente en Osakidetza, con la formacion y sensibilizacion del personal como pilares fundamentales.
Común A2 / Técnico;177;tec-comun-t15_17;Segun el Resumen Ejecutivo del Plan Oncologico Integral de Euskadi (POIE) 2025-2030, de que porcentaje de los fallecimientos en Euskadi fue responsable el cancer en el año 2023?;22,3%.;Menos del 15%.;33,8%.;28%.;C;B;D;C;A;No;25.8%;Disputa / Duda;REVISAR MANUALMENTE: consulta texto legal;POIE 2025-2030 (Resumen Ejecutivo): El cáncer es responsable del 28% de las muertes en Euskadi, siendo la segunda causa de mortalidad. La C recoge correctamente este porcentaje. Respuesta C.
Administrativo (específico);161;adm-prl-prevencion-riesgos_7;Según el artículo 2 de la Ley 31/1995, de Prevención de Riesgos Laborales, la presente Ley será de aplicación:;Únicamente a las relaciones laborales reguladas por el Estatuto de los Trabajadores.;Únicamente al personal al servicio de la Administración Pública.;A las relaciones laborales reguladas por el Estatuto de los Trabajadores y al personal al servicio de las Administraciones Públicas.;Las respuestas a) b) y c) son incorrectas.;C;C;D;?;C;No;19.7%;Disputa / Duda;REVISAR MANUALMENTE: consulta texto legal;Art. 2.1 Ley 31/1995 (ámbito de aplicación): 'Esta Ley y sus normas de desarrollo serán de aplicación tanto en el ámbito de las relaciones laborales reguladas en el texto refundido del ESTATUTO DE LOS TRABAJADORES, como en el de las relaciones de carácter administrativo o estatutario del PERSONAL CIVIL AL SERVICIO DE LAS ADMINISTRACIONES PÚBLICAS.' Doble ámbito: ET + AAPP. Respuesta C.
Auxiliar Administrativo (específico);120;aux-e04_1;Las revisiones de oficio de los actos administrativos nulos o anulables, los recursos administrativos extraordinarios y las reclamaciones previas a las vías jurisdiccionales civil y laboral que no comprendan la exigencia de responsabilidad, serán conocidas por:;La Presidencia o por el Director General de Osakidetza-Servicio Vasco de Salud.;El Consejo de Administración o por los Directores-Gerentes de Osakidetza-Servicio Vasco de Salud.;La Presidencia o por el Consejo de Administración de Osakidetza-Servicio Vasco de Salud.;El Director General o por los Directores-Gerentes de las organizaciones de Osakidetza-Servicio Vasco de Salud.;D;A;C;A;D;No;13.1%;Disputa / Duda;REVISAR MANUALMENTE: consulta texto legal;Decreto 255/1997: las revisiones de oficio y recursos extraordinarios corresponden a la Presidencia o Director General.
Técnico Superior Administrativo (específico);160;tec-t06_10;Diga cuál de los siguientes NO forma parte de los principios y criterios de ordenación del régimen estatutario:;La libre circulación del personal estatutario en el conjunto del Sistema Nacional de Salud.;La dedicación prioritaria al servicio público.;El acuerdo con las organizaciones sindicales en la determinación de las condiciones de trabajo.;La igualdad, mérito, capacidad y publicidad en el acceso a la condición de personal estatutario.;B;B;C;?;?;No;38.5%;Disputa / Duda;REVISAR MANUALMENTE: consulta texto legal;"Art. 4 Ley 55/2003: los principios de ordenación del régimen estatutario incluyen libre circulación, igualdad en el acceso, negociación colectiva, entre otros. La ""dedicación prioritaria al servicio público"" no figura como principio de ordenación del régimen estatutario."
Técnico Superior Administrativo (específico);164;tec-t06_14;Conforme a la Ley 55/2003, el catálogo homogéneo de equivalencias de categorías profesionales de los distintos servicios de salud, ¿cuya aprobación corresponde a quién?;A la Comisión de Recursos Humanos del Sistema Nacional de Salud.;Al Consejo Interterritorial del Sistema Nacional de Salud.;Al Foro Marco para el Diálogo Social.;Todas las respuestas anteriores son incorrectas.;A;A;D;?;?;No;38.5%;Disputa / Duda;REVISAR MANUALMENTE: consulta texto legal;Art. 8 Ley 55/2003: la Comisión de Recursos Humanos del Sistema Nacional de Salud es el órgano competente para aprobar el catálogo homogéneo de equivalencias entre las categorías profesionales de los distintos servicios de salud.
Técnico Superior Administrativo (específico);170;tec-t06_20;Conforme a la Ley 55/2003, cuando de un procedimiento de movilidad se derive cambio en el servicio de salud de destino, el plazo de toma de posesión será de:;Treinta días, a contar desde el día del cese en el destino anterior, que deberá tener lugar en los tres días siguientes a la notificación o publicación del nuevo destino adjudicado.;Treinta días, a contar desde el día del cese en el destino anterior, que deberá tener lugar en los diez días siguientes a la notificación o publicación del nuevo destino adjudicado.;Un mes, a contar desde el día del cese en el destino anterior, que deberá tener lugar en los tres días siguientes a la notificación o publicación del nuevo destino adjudicado.;Un mes, a contar desde el día del cese en el destino anterior, que deberá tener lugar en los diez días siguientes a la notificación o publicación del nuevo destino adjudicado.;A;A;C;?;?;No;38.5%;Disputa / Duda;REVISAR MANUALMENTE: consulta texto legal;Art. 39 Ley 55/2003: cuando la movilidad implica cambio de servicio de salud, el cese en el destino anterior debe producirse en los tres días siguientes a la notificación y el plazo de toma de posesión es de treinta días desde el cese.
Técnico Superior Administrativo (específico);174;tec-t06_24;Conforme a la Ley 55/2003, la persona interesada tendrá derecho a incorporarse a plaza de la misma categoría y área de salud en que prestaba sus servicios, si la revisión de incapacidad se produce:;Dentro de los cinco años siguientes a la fecha de la declaración de incapacidad.;Dentro de los tres años siguientes a la fecha de la declaración de incapacidad.;Dentro de los dos años siguientes a la fecha de la declaración de incapacidad.;Dentro de los cuatro años siguientes a la fecha de la declaración de incapacidad.;A;A;D;?;?;No;38.5%;Disputa / Duda;REVISAR MANUALMENTE: consulta texto legal;Art. 57.3 Ley 55/2003: cuando la condición de personal estatutario se pierde por incapacidad y esta es revisada, la persona tiene derecho a reincorporarse si la revisión se produce dentro de los cinco años siguientes a la declaración de incapacidad.
Técnico Superior Administrativo (específico);175;tec-t06_25;Conforme a la Ley 55/2003, los procedimientos de movilidad voluntaria del personal estatutario se efectuarán preferentemente:;Cada año.;Cada dos años.;Cada dieciocho meses.;Cada tres años.;A;A;B;?;?;No;38.5%;Disputa / Duda;REVISAR MANUALMENTE: consulta texto legal;Art. 37 Ley 55/2003: los procedimientos de movilidad voluntaria mediante concurso se convocarán con carácter general, como mínimo, cada dos años. La frecuencia preferente según la norma es anual.
Técnico Superior Administrativo (específico);189;tec-t06_39;Conforme a la Ley 55/2003, el quebranto de la debida reserva respecto a datos relativos al centro o institución o a la intimidad personal de las personas usuarias y a la información relacionada con su proceso:;Constituye falta muy grave.;Constituye falta grave.;Constituye falta leve.;Constituye un incumplimiento del ordenamiento jurídico, no tipificado como falta.;B;B;A;?;?;No;38.5%;Disputa / Duda;REVISAR MANUALMENTE: consulta texto legal;Art. 73 Ley 55/2003: el quebranto de la debida reserva respecto a datos del centro o de la intimidad de los pacientes, cuando no constituya falta muy grave, es tipificado como falta grave.
Técnico Superior Administrativo (específico);190;tec-t06_40;Conforme a la Ley 55/2003, el acoso sexual, cuando el sujeto activo del acoso crea con su conducta un entorno laboral intimidatorio, hostil o humillante para la persona que es objeto del mismo:;Constituye falta muy grave.;Constituye falta grave.;Constituye falta leve.;Constituye un incumplimiento del ordenamiento jurídico, no tipificado como falta.;A;A;B;?;?;No;38.5%;Disputa / Duda;REVISAR MANUALMENTE: consulta texto legal;Art. 72 Ley 55/2003: el acoso sexual que cree un entorno intimidatorio, hostil o humillante constituye falta muy grave, independientemente de que no exista una demanda concreta de favores sexuales.
